{
  "protocol": "ott",
  "version": "1.0",
  "profiles": ["static"],
  "adapter_version": "fixture",
  "updated_at": "2026-07-13T00:00:00+00:00",
  "features": {
    "entry_summary": true,
    "inline_content": true,
    "segmented_content": true,
    "search": false,
    "static_fallback": true
  }
}
